{
  "v": 1,
  "type": "offer",
  "roomId": "room-42",
  "senderId": "user-ada",
  "sessionId": "sess-abc-0001",
  "ts": 1786000001000,
  "seq": 2,
  "payload": {
    "sdp": "v=0\r\no=- 4611731406677955671 2 IN IP4 127.0.0.1\r\ns=-\r\nt=0 0\r\na=group:BUNDLE 0\r\nm=audio 9 UDP/TLS/RTP/SAVPF 111\r\na=mid:0\r\na=sendrecv\r\na=rtpmap:111 opus/48000/2\r\nm=video 9 UDP/TLS/RTP/SAVPF 96\r\na=mid:1\r\na=sendrecv\r\na=rtpmap:96 VP8/90000",
    "label": "main"
  }
}
