{
  "v": 1,
  "type": "join",
  "roomId": "room-42",
  "senderId": "user-ada",
  "sessionId": "sess-abc-0001",
  "ts": 1786000000000,
  "seq": 1,
  "payload": {
    "displayName": "Ada Lovelace",
    "metadata": {
      "tier": "pro",
      "locale": "en"
    },
    "deviceProfile": {
      "hardwareConcurrency": 8,
      "deviceMemory": 8.0,
      "mobile": false,
      "screenWidth": 1920,
      "screenHeight": 1080,
      "platform": "kotlin"
    },
    "capabilities": {
      "simulcast": true,
      "svc": false,
      "codecs": [
        "VP8",
        "H264"
      ]
    }
  }
}
